{
  "id": "SQI_B1", "metodologia": "SQI", "bimestre": 1, "total": 6,
  "fuente": "Lineamientos estudiantes SQI",
  "componentes": [
    { "id": "practicas", "nombre": "Prácticas", "valor": 3.0, "unidad": "grupo", "items": { "P1": 0.20, "P2": 0.30, "P3": 0.50 } },
    { "id": "trabajos_casa", "nombre": "Trabajos en casa", "valor": 2.0, "unidad": "grupo", "escala": 10, "registro": "por_pregunta",
      "solo_presentes_en_la_practica": true,
      "items": { "TC1": 0.40, "TC2": 0.25, "TC3": 0.35 } },
    { "id": "talleres", "nombre": "Talleres", "valor": 1.0, "items": { "T1": 1, "T2": 1, "T3": 1 } }
  ]
}
